{"kind":"d8_dependency_pivot_audit","schema_version":1,"auditor_version":"1.0.0","semantics_version":"exact-incidence-root-pivot-v1","complete":true,"limitations":["Enumerates role-labelled loopless dependency digraphs; no isomorphism quotient is taken.","Exact-incidence and root-pivot checks do not establish physical edge-colouring realizability.","Does not verify alternating-component pairing, J-rainbow safety, criticality, or the open D=8 extension statement."],"profiles":[{"profile_id":"d8-a-w5","vertex_count":5,"active_indegrees":[3,2,2,2],"mobile_triple_columns":[0],"inert_multiplicity":2,"counts":{"candidate_assignments":864,"root_outdegree_at_least_two":675,"root_reachable":834,"dependency_admissible":675,"incidence_admissible":237,"initial_all_mobile_triples_fragile":6,"pivot_resolved":6,"pivot_unresolved":0,"minimum_pivot_depth_histogram":{"0":231,"1":6}}},{"profile_id":"d8-b-w6","vertex_count":6,"active_indegrees":[3,3,2,2,1],"mobile_triple_columns":[0,1],"inert_multiplicity":2,"counts":{"candidate_assignments":50000,"root_outdegree_at_least_two":37136,"root_reachable":47147,"dependency_admissible":37064,"incidence_admissible":5787,"initial_all_mobile_triples_fragile":32,"pivot_resolved":32,"pivot_unresolved":0,"minimum_pivot_depth_histogram":{"0":5755,"1":32}}},{"profile_id":"d8-c-frozen-w5","vertex_count":5,"active_indegrees":[3,3,1,1],"mobile_triple_columns":[0,1],"inert_multiplicity":3,"counts":{"candidate_assignments":256,"root_outdegree_at_least_two":187,"root_reachable":232,"dependency_admissible":178,"incidence_admissible":85,"initial_all_mobile_triples_fragile":8,"pivot_resolved":8,"pivot_unresolved":0,"minimum_pivot_depth_histogram":{"0":77,"1":8}}},{"profile_id":"d8-c-frozen-w6","vertex_count":6,"active_indegrees":[3,3,2,1,1],"mobile_triple_columns":[0,1],"inert_multiplicity":3,"counts":{"candidate_assignments":25000,"root_outdegree_at_least_two":17064,"root_reachable":22006,"dependency_admissible":16404,"incidence_admissible":3978,"initial_all_mobile_triples_fragile":248,"pivot_resolved":248,"pivot_unresolved":0,"minimum_pivot_depth_histogram":{"0":3730,"1":224,"2":24}}},{"profile_id":"d8-c-frozen-w7","vertex_count":7,"active_indegrees":[3,3,2,2,1,1],"mobile_triple_columns":[0,1],"inert_multiplicity":3,"counts":{"candidate_assignments":3240000,"root_outdegree_at_least_two":2140000,"root_reachable":2791925,"dependency_admissible":2062011,"incidence_admissible":232049,"initial_all_mobile_triples_fragile":9368,"pivot_resolved":9228,"pivot_unresolved":140,"minimum_pivot_depth_histogram":{"0":222681,"1":7856,"2":1212,"3":160}}},{"profile_id":"d8-c-mobile-w6","vertex_count":6,"active_indegrees":[3,3,3,1,1],"mobile_triple_columns":[0,1,2],"inert_multiplicity":2,"counts":{"candidate_assignments":25000,"root_outdegree_at_least_two":18856,"root_reachable":22890,"dependency_admissible":18208,"incidence_admissible":3192,"initial_all_mobile_triples_fragile":0,"pivot_resolved":0,"pivot_unresolved":0,"minimum_pivot_depth_histogram":{"0":3192}}},{"profile_id":"d8-c-mobile-w7","vertex_count":7,"active_indegrees":[3,3,3,2,1,1],"mobile_triple_columns":[0,1,2],"inert_multiplicity":2,"counts":{"candidate_assignments":4320000,"root_outdegree_at_least_two":3095000,"root_reachable":3871131,"dependency_admissible":2999927,"incidence_admissible":193713,"initial_all_mobile_triples_fragile":246,"pivot_resolved":246,"pivot_unresolved":0,"minimum_pivot_depth_histogram":{"0":193467,"1":246}}}]}
